{
  "scenario_id": "A4_robot_does_not_confirm_delivery",
  "contract_id": "contract.ig.json",
  "verdict": "UNSAT",
  "num_events": 8,
  "num_violations": 1,
  "violations": [
    {
      "violation_id": "v001",
      "violated_operator": "acknowledgment",
      "agent_attribution": "robot_1",
      "site": "closure",
      "trigger_event_id": "e006",
      "expected_event": "robot_1_robot_confirms_delivery",
      "observed_event": null,
      "deadline_seconds": null,
      "trigger_time": 4.93,
      "falsification_time": 31.5,
      "error_code": "V_SEQ_MISSING_RIGHT",
      "clause_path": "$.items[1]"
    }
  ],
  "raw_auditor_output": {
    "verdict": "FAIL",
    "operator": "sequence",
    "clause_path": "$.items[1]",
    "error_code": "V_SEQ_MISSING_RIGHT",
    "budget": null,
    "observed": {
      "after_left_until": 1782207834.768092
    },
    "responsible_agent": "robot_1",
    "expected": {
      "right": "Present after left",
      "object": "robot_confirms_delivery"
    },
    "witness": {
      "left_event": {
        "idx": 5,
        "event": {
          "t": 1782207808.2016056,
          "prim": "α",
          "agent": "human_1",
          "channel": "speech",
          "object": "user_acknowledges_delivery"
        }
      }
    }
  }
}