{
  "scenario_id": "C2_repair_exhausted",
  "contract_id": "contract.ig.json",
  "verdict": "UNSAT",
  "num_events": 3,
  "num_violations": 1,
  "violations": [
    {
      "violation_id": "v001",
      "violated_operator": "repair_exhausted",
      "agent_attribution": "human_1",
      "site": "repair",
      "trigger_event_id": "e003",
      "expected_event": "human_1_user_responds_to_prompt",
      "observed_event": null,
      "deadline_seconds": null,
      "trigger_time": 6.39,
      "falsification_time": 6.39,
      "error_code": "V_REPAIR_EXHAUSTED",
      "clause_path": "$.items[1]"
    }
  ],
  "raw_auditor_output": {
    "verdict": "FAIL",
    "operator": "repair",
    "clause_path": "$.items[1]",
    "error_code": "V_REPAIR_EXHAUSTED",
    "budget": "retries ≤ 1",
    "observed": {
      "attempts": 2
    },
    "responsible_agent": "human_1",
    "expected": {},
    "witness": {
      "last_failure": {
        "verdict": "FAIL",
        "operator": "sequence",
        "clause_path": "$.items[1].expr",
        "error_code": "V_SEQ_MISSING_RIGHT",
        "budget": null,
        "observed": {
          "after_left_until": 1783078620.526849
        },
        "responsible_agent": "human_1",
        "expected": {
          "right": "Present after left",
          "object": "user_responds_to_prompt"
        },
        "witness": {
          "left_event": {
            "idx": 2,
            "event": {
              "t": 1783078620.526849,
              "prim": "α",
              "agent": "robot_1",
              "channel": "speech",
              "object": "robot_prompts_user"
            }
          }
        }
      }
    }
  }
}