{
  "scenario_id": "missing_ack_03",
  "contract_id": "scenario3_combined_v1",
  "verdict": "UNSAT",
  "num_events": 4,
  "num_violations": 1,
  "violations": [
    {
      "violation_id": "v001",
      "violated_operator": "acknowledgment",
      "agent_attribution": "robot_1",
      "site": "closure",
      "trigger_event_id": "e004",
      "expected_event": "expected_response",
      "observed_event": null,
      "deadline_seconds": null,
      "trigger_time": 3.77,
      "falsification_time": 3.77,
      "error_code": "V_SEQ_MISSING_RIGHT",
      "clause_path": "$.items[1]"
    }
  ],
  "raw_auditor_output": {
    "verdict": "FAIL",
    "operator": "sequence",
    "clause_path": "$.items[1]",
    "error_code": "V_SEQ_MISSING_RIGHT",
    "budget": null,
    "observed": {
      "after_left_until": 1778335900.5472083
    },
    "responsible_agent": "robot_1",
    "witness": {
      "left_event": {
        "idx": 3,
        "event": {
          "t": 1778335900.5472083,
          "prim": "α",
          "agent": "human_1",
          "channel": "speech",
          "object": "ack"
        }
      }
    }
  }
}